{
  "schemaVersion": "1.1.0",
  "reportId": "REP-UX-2026-001",
  "runId": "RUN-UX-2026-001",
  "correlationId": "CORR-DEMO-0001",
  "sourceSha256": "aaaaaaaaaaaaaaaaaaaaaaaaaaaaaaaaaaaaaaaaaaaaaaaaaaaaaaaaaaaaaaaa",
  "catalogVersion": "0.2.0",
  "controlProfileId": "inbound-starter-de-v1",
  "controlProfileVersion": "0.2.0",
  "status": "unauffaellig",
  "routing": "standard_review",
  "controls": [
    {
      "controlId": "DOC-001",
      "title": "Input readable and supported",
      "outcome": "passed",
      "severity": "none",
      "reasonCodes": [],
      "evidenceRefs": ["document.sha256"],
      "ruleVersion": "1.0.0",
      "message": null
    },
    {
      "controlId": "STR-004",
      "title": "Official structured business rules (Schematron) satisfied",
      "outcome": "passed",
      "severity": "none",
      "reasonCodes": [],
      "evidenceRefs": [],
      "ruleVersion": "1.09",
      "message": null
    }
  ],
  "suggestions": [],
  "reqeli": { "invoked": false, "status": "not_required", "analysisRef": null },
  "startedAt": "2026-08-07T08:59:57+02:00",
  "createdAt": "2026-08-07T09:00:00+02:00"
}
